Asset_Name,Type,Source_URL,License_or_Permission,Used_In,Credit_Required,Risk_Level,Action
TMDB API,Movie Database API,https://developer.themoviedb.org,TMDB API Terms of Use,"Movie search, recommendations, and movie details (FR-04, FR-05, FR-06)",Yes,Medium,"Display TMDB attribution and follow API terms."
OpenAI API,AI Service,https://platform.openai.com,OpenAI API Terms of Use,"AI chatbot and personalized recommendations (FR-03)",No,Medium,"Store API keys securely and never expose them to clients."
Tailwind CSS,CSS Framework,https://tailwindcss.com,MIT License,"All prototype pages",No,Low,"Keep for MVP and optimize CSS for production."
Google Fonts (Poppins),Font,https://fonts.google.com,SIL Open Font License 1.1,"Typography across the application",No,Low,"Bundle locally for production if needed."
Google Material Symbols,Icon Library,https://fonts.google.com/icons,Apache License 2.0,"Navigation icons and UI components",No,Low,"Maintain consistent icon usage."
YouTube Embedded Player,Video Service,https://www.youtube.com,YouTube Terms of Service,"Movie trailer playback (FR-06)",Yes,Medium,"Use official embedded player only."
Mermaid.js,Diagram Library,https://mermaid.js.org,MIT License,"System architecture and workflow diagrams",No,Low,"Keep for GitHub documentation."
Placeholder Movie Images,Image Assets,https://placehold.co,Free Placeholder License,"Prototype movie posters",No,Low,"Replace with official TMDB posters before production."
